[
    {
        "query": "What is considered Academic Probation?",
        "retrieved_contexts": [
            {
                "tool_name": "vector_retriever",
                "context": "url: no url\n\n# Academic Warning and Probation\n\nAll students issued an academic warning are strongly recommended to meet with the Director of Academic Advising or designee to discuss their academic progress. Students should also consult with their academic advisor.\n\nAll students issued a signature work academic warning strongly recommended to meet with the Director of Academic Advising or designee and the Director of Signature Work or designee. The student’s signature work mentor and academic advisor will be notified and may also be present at the meeting. If the signature work mentor and/or academic advisor is not present at the meeting, the student should also consult with them.\n\n# Academic Probation\n\nFor a student enrolled in 16 or more credits, the following grades will result in academic probation for the succeeding spring or fall term: during the first term of the freshman year, grades including DD, DF, or FF; during any subsequent spring/fall term, grades including DDD, DF or FF (as long as the student has passed at least 12 credits); and during two consecutive spring/fall terms, grades including DDDD, DDDF, or DDFF. For a student enrolled in an authorized underload (i.e., fewer than 16 credits), the following academic performance will result in academic probation: during the first term of the freshman year, grades of DD or F; during any subsequent fall/spring term, grades including DDD or DF (as long as 12 credits have been passed in that term); and during two consecutive spring/fall terms, grades including DDDD, DDDF, or DDFF.\n\nIn a case where probation may be in question because of an incomplete grade, the student will be notified by the Office of the Registrar of the need to have the incomplete replaced by a satisfactory grade in order to avoid academic probation. That is, the satisfactory final grade must be sufficient to avoid the combination of D and F grades that would result in academic probation, as described above.\n\nThe probationary status will be reflected on those academic records used for internal purposes only. Students placed on academic probation must acknowledge their probationary status in writing to the Office of Undergraduate Advising in order to continue at the University. They are also required to meet with the Director of Academic Advising or designee and are expected to seek assistance from campus resources, have their course selection approved by their advisors and meet periodically with a designated academic coach. They may not study away during the probation period.\n\nStudents are expected to clear their probationary status during the term of probation. In order to do so, they must enroll in 16 credits (plus up to one PE credit), of which no more than 4 credits may be taken on a Credit/No Credit basis. Grades of C, CR, or better must be earned in each course, or a C average must be achieved in that term.\n\nProbationary status cannot be cleared in a term in which students seek permission and are allowed to withdraw to an underload. In such cases, the probationary status continues through the next fall or spring term of enrollment. Students who clear their probationary status by earning a C average in the term but also earn grades that would result in academic probation as described above will continue their probationary status through the next term of enrollment. Students on probation, whether in a normal load or an underload, are required to earn grades of C, CR, or better in each course, or achieve a C average in that term. Students whose probationary status continues to a\n\nurl: https://duke.box.com/s/u6ajvjuo2yocn57rld4ztu6jrrdxfn0n\n\n# 3. Failure to meet the term credit requirements (see section on Term Credit Requirements)\n\n# 4. A grade of C- or below for CAPSTONE 495 Signature Work Capstone I\n\n# 5. Failure to meet Signature Work milestones and submission deadlines (mentor agreement, project proposal, or other documentation).\n\nAll students issued an academic warning are required to meet with the Director of Academic Advising or delegate to discuss their academic progress. Students should also consult with their academic advisor.\n\nAll students issued a signature work academic warning are required to meet with the Director of Academic Advising or delegate and the Director of Signature Work or delegate. The student’s signature work mentor and academic advisor will be notified and may also be present at the meeting. If the signature work mentor and/or academic advisor is not present at the meeting, the student should also consult with them.\n\n# Academic Probation\n\nAt the end of each fall and spring term, a student must have both a term and a cumulative grade point average of at least 2.000. Failure to meet either of the two following standards will result in academic probation for the following fall or spring term:\n\n1. Term grade-point average below 2.000 for any fall or spring term\n2. Cumulative grade-point average falls below 2.000 at the end of any fall or spring term.\n\nIn a case where probation may be in question because of an incomplete grade, the student will be notified by the Office of the Registrar of the need to have the incomplete replaced by a satisfactory grade in order to avoid academic probation. That is, the satisfactory final grade must be sufficient to raise both the term and the cumulative grade-point averages to or above 2.000.\n\nThe probationary status will be reflected on those academic records used for internal purposes only. Students placed on academic probation must acknowledge their probationary status in writing to the Office of Undergraduate Advising in order to continue at the University. They are also required to meet with the Director of Academic Advising or delegate and are expected to seek assistance from campus resources, have their course selection approved by their advisors and meet periodically with a designated academic coach. They may not study away during the probation period. Students are expected to clear their probationary status during the term of probation. In order to do so, they must enroll in 16 credits (plus up to one PE credit), of which no more than 4 credits may be taken on a Credit/No Credit basis, and achieve term and cumulative grade-point averages of at least 2.000.\n\nProbationary status cannot be cleared in a term in which students seek permission and are allowed to withdraw to an underload. In such cases, the probationary status continues through the next fall or spring term of enrollment. Students on probation, whether in a normal load or an underload, are required to achieve the minimum term and cumulative grade-point averages of at least 2.000. Students whose probationary status continues to a second term for reason of an underload must\n\nurl: no url\n\n# Academic Suspension\n\nStudents on academic probation must clear their probationary status as described above (see section on Academic Probation) in order to continue at Duke Kunshan University. For the purposes of clearing academic probation, incomplete work in any course is considered a failure to achieve satisfactory performance in that course. Therefore, where academic suspension is in question, incomplete work in any course must be completed with a satisfactory grade sufficient to clear the probationary status in time for final grades to be submitted to the Office of the Registrar no later than the weekday preceding the first day of classes of the subsequent fall or spring term.\n\nStudents who fail to meet the minimum requirements to clear their probationary status are subject to academic suspension for a period of at least two terms (excluding summer term). Those desiring to return after the suspension period may apply for Return to the University. Such students are placed on academic probation if reinstated. Please contact the Office of Undergraduate Studies for more information. Deadlines for filing this application are 5:00 p.m. China time May 1 for return in the subsequent Fall Term and October 15 for return in the subsequent Spring Term (see section on Return). If after return the student fails again to meet the minimum academic requirements and is suspended a second time, the student is eligible to apply for return no sooner than two years or four terms (excluding summer terms) after the term of the second withdrawal.\n\nThough rarely granted, a student suspended for failure to clear their probationary status may appeal for immediate reinstatement. Students should contact the Director of Academic Advising or designee and adhere to deadlines stated in their suspension letter.\n\n# Academic Warning, Probation, and Suspension for Students in the Class of 2025 and Beyond\n\nA student whose academic performance record indicates marginal scholarship, as assessed by grades, as well as term and cumulative grade-point averages, will be subject either to academic warning or academic probation. Failure to clear probationary status in the term of probation will result in a student’s suspension for academic reasons. Students who are not making satisfactory progress meeting Signature Work milestones will be issued an academic warning.\n\nIn determining whether a student should be placed on academic warning, a grade of NC earned in a course, whether that course is offered only on the CR/NC basis or the student elects to take it on the CR/NC basis, is considered equivalent to a grade of F (see also the section on CR/NC Grading system).\n\nFor purposes of determining academic standing, incomplete work in a course indicated by a grade of I is considered equivalent to a grade of F until the I is resolved (see section on Incomplete Coursework). Grades in PE courses are not considered in determining academic warning, probation, or suspension.\n\nurl: no url\n\n# Academic Warning\n\nFailure to meet any of the following standards will result in academic warning by the Office of Undergraduate Advising:\n\n1. A single or more grade of F or NC (excluding PE courses) in a term\n2. A second or more grade of D (D, D-, D+) over the student’s tenure at DKU\n3. Failure to meet the term credit requirements (see section on Term Credit Requirements)\n4. A grade of C- or below for CAPSTONE 495 Signature Work Capstone I\n5. Failure to meet Signature Work milestones and submission deadlines (mentor agreement, project proposal, or other documentation).\n\nAll students issued an academic warning are strongly recommended to meet with the Director of Academic Advising or designee to discuss their academic progress. Students should also consult with their academic advisor.\n\nAll students issued a signature work academic warning are strongly recommended to meet with the Director of Academic Advising or designee and the Director of Signature Work or designee. The student’s signature work mentor and academic advisor will be notified and may also be present at the meeting. If the signature work mentor and/or academic advisor is not present at the meeting, the student should also consult with them.\n\n# Academic Probation\n\nAt the end of each fall and spring term, a student must have both a term and a cumulative grade point average of at least 2.000. Failure to meet either of the two following standards will result in academic probation for the following fall or spring term:\n\n1. Term grade-point average below 2.000 for any fall or spring term\n2. Cumulative grade-point average falls below 2.000 at the end of any fall or spring term.\n\nIn a case where probation may be in question because of an incomplete grade, the student will be notified by the Office of the Registrar of the need to have the incomplete replaced by a satisfactory grade in order to avoid academic probation. That is, the satisfactory final grade must be sufficient to raise both the term and the cumulative grade-point averages to or above 2.000.\n\nThe probationary status will be reflected on those academic records used for internal purposes only. Students placed on academic probation must acknowledge their probationary status in writing to the Office of Undergraduate Advising in order to continue at the University. They are also required to meet with the Director of Academic Advising or designee and are expected to seek assistance from campus resources, have their course selection approved by their advisors and meet periodically with a designated academic coach. They may not study away during the probation period. Students are expected to clear their probationary status during the term of probation. In order to do so, they must enroll in 16 credits (plus up to one PE credit), of which no more than 4 credits may be taken on a Credit/No Credit basis, and achieve term and cumulative grade-point averages of at least 2.000.\n\nurl: https://ugstudies.dukekunshan.edu.cn/academic-policies-and-procedures/\n\nA single or more grade of F or NC (excluding PE courses) in a term\n2. A second or more grade of D (D, D-, D+) over the student’s tenure at DKU\n3. Failure to meet the term credit requirements (See section on Term Credit Requirements\n\nAll students issued an academic warning are required to meet with the Director for Academic Advising or designee to discuss their academic progress. Students should also consult with their academic advisor.\n\n \n\n \n\n##### Academic Probation\n\n \n\nFor a student enrolled in 16 or more credits, the following grades will result in academic probation for the succeeding spring or fall term: during the first term of the freshman year, grades including DD, DF, or FF; during any subsequent spring/fall term, grades including DDD, DF or FF (as long as the student has passed at least 12 credits); and during two consecutive spring/fall terms, grades including DDDD, DDDF, or DDFF. For a student enrolled in an authorized underload (i.e., fewer than 16 credits), the following academic performance will result in academic probation: during the first term of the freshman year, grades of DD or F; during any subsequent fall/spring term, grades including DDD or DF (as long as 12 credits have been passed in that term); and during two consecutive spring/fall terms, grades including DDDD, DDDF, or DDFF. In a case where probation may be in question because of an incomplete grade, the student will be notified by the Office of the Registrar of the need to have the incomplete replaced by a satisfactory grade in order to avoid academic probation. That is, the satisfactory final grade must be sufficient to avoid the combination of D and F grades that would result in academic probation, as described above.\n\n \n\nThe probation status will be reflected on those academic records used for internal purposes only. Students placed on academic probation must acknowledge their probationary status in writing to the Office of Undergraduate Studies in order to continue at the University. They are also required to meet with the Director for Academic Advising or designee and are expected to seek assistance from campus resources, have their course selection approved by their advisors and meet periodically with a designated academic coach. They may not study away during the probation period. Students are expected to clear their probationary status during the term of probation. In order to do so, they must enroll in 16 credits (plus up to one PE credit), of which no more than 4 credits may be taken on a Credit/No Credit basis. Grades of C, CR, or better must be earned in each course, or a C average must be achieved in that term.\n\n \n\nProbationary status cannot be cleared in a term in which students seek permission and are allowed to withdraw to an underload. In such cases, the probationary status continues through the next fall or spring term of enrollment. Students who clear their probationary status by earning a C average in the term but also earn grades that would result in academic probation as described above will continue their probationary status through the next term of enrollment. Students on probation, whether in a normal load or an underload, are required to earn grades of C, CR, or better in each course, or achieve a C average in that term. Students whose probationary status continues to a second term for reason of an underload must adhere to the conditions and standards previously outlined for clearing probation. Failure to do so will result in academic suspension.\n\n \n\n \n\n##### Academic Suspension\n\n  \n\nStudents on academic probation must clear their probationary status as described above (see section on Academic Probation) in order to continue at Duke Kunshan University. For the purposes of clearing academic probation, incomplete work in any course is considered a failure to achieve satisfactory performance in that course. Therefore, where term continuation is in question, incomplete work in any course must be completed with a satisfactory grade sufficient to clear the probationary status in time for final grades to be submitted to the Office of the University Registrar no later than the weekday preceding the first day of classes of the subsequent fall or spring term.\n\n \n\nStudents who fail to meet the minimum requirements to clear their probationary status are subject to academic suspension for a period of at least two terms (excluding summer term). Those desiring to return after the suspension period may apply for Return to the University. Such students are placed on academic probation if reinstated. Please contact the Office of Undergraduate Studies for more information. Deadlines for filing this application are 5:00 p.m.\n\nurl: no url\n\n# Probationary Status\n\nProbationary status cannot be cleared in a term in which students seek permission and are allowed to withdraw to an underload. In such cases, the probationary status continues through the next fall or spring term of enrollment. Students on probation, whether in a normal load or an underload, are required to achieve the minimum term and cumulative grade-point averages of at least 2.000. Students whose probationary status continues to a second term for reason of an underload must adhere to the conditions and standards previously outlined for clearing probation. Failure to do so will result in academic suspension.\n\n# Academic Suspension\n\nStudents on academic probation must clear their probationary status as described above (see section on Academic Probation) in order to continue at Duke Kunshan University. For the purposes of clearing academic probation, incomplete work in any course is considered a failure to achieve satisfactory performance in that course. Therefore, where academic suspension is in question, incomplete work in any course must be completed with a passing grade in time for final grades to be submitted to the Office of the University Registrar no later than the weekday preceding the first day of classes of the subsequent fall or spring term.\n\nStudents who fail to meet the minimum requirements to clear their probationary status are subject to academic suspension for a period of at least two terms (excluding summer term). Those desiring to return to the University after the suspension period must apply for return. Such students are placed on academic probation if reinstated. Please contact the Office of Undergraduate Studies for more information. Deadlines for filing this application are 5:00 p.m. China time May 1 for return in the subsequent Fall Term and October 15 for return in the subsequent Spring Term (see section on Return). If after return the student fails again to meet the minimum academic requirements and is suspended a second time, the student is eligible to apply for return no sooner than two years or four terms (excluding summer terms) after the term of the second withdrawal.\n\nThough rarely granted, a student suspended for failure to clear their probationary status may appeal for immediate reinstatement. Students should contact the Director of Academic Advising or designee and adhere to deadlines stated in their suspension letter.\n\n# Changes in Status\n\n# Voluntary Withdrawal\n\nStudents who wish to withdraw from the university must give official notification to the Office of Undergraduate Studies. Notification must be received prior to the beginning of classes in any term, or tuition and housing fee will be refunded only partially (see section on Refund in Part 5). For students withdrawing on their own initiative after the beginning of classes and up to the last teaching day of the fifth week of 7-week classes or of the tenth week of 14-week classes in the fall or spring terms, a W is assigned in lieu of a regular grade for each course. After these dates, up until the end of the last day of classes of that session, an F grade is recorded unless withdrawal is caused by an emergency beyond the control of the student, in which case a W is assigned by the University Registrar. Alternatively, students withdrawing for medical reasons during this period.\n\nurl: https://graduate-program.s3.cn-north-1.amazonaws.com.cn/wp-content/uploads/2021/03/04151409/2020-2021-Pratt-Bulletin.pdf\n\nMEM - Academic Integrity\n---\nInvestigating\n\nOnce a suspected violation has been brought to the attention of the executive director of the MEM Program, he/she may consult with the associate dean for student conduct to decide whether any further investigation is warranted and possible. They will also assess the severity of the allegations and the executive director of MEM Program will review the disciplinary record of the person suspected to see if there are any previous violations that would preclude a “one-time faculty/student resolution.” If there is to be a further investigation, the executive director of the MEM Program will notify the individual/group that an academic investigation is being held and specify the university policy that is suspected of being violated. The executive director of the MEM Program will gather information regarding the alleged incident in order to determine the appropriate means of resolution. Investigations may include a review of related documents, interviews, or requests for written statements from any person involved in the alleged incident. Please be aware that students and organizations that lie during the investigation phase or any other aspect of the judicial process are violating the Duke Community Standard. Additionally, sanctions for multiple infractions are typically more severe than sanctions for single infractions.\n\nCases may be dropped for insufficient information, or referred for possible disciplinary action. In order for a case to be referred for possible disciplinary action, there must be sufficient information to believe that a policy violation may have occurred and that the alleged individual/group may be responsible.\n\nResolving Violations\n\nSuspected violations are resolved dependent on their severity and the student’s disciplinary history.\n\nOne-Time Student-Faculty Resolution. When the suspected violation is “minimal,” such that it would not put the student at risk of suspension or expulsion (e.g., inadvertent omission of a citation or improper citation, minor misunderstanding about collaboration or use of materials on an assignment), and when the student has not committed any previous violations, it may be possible to resolve the situation at the level of the faculty member in charge of the course and the student. The first, and essential, stage in this process is for the faculty member to discuss the situation with the executive director of the MEM Program to determine if the suspected violation is in fact “minimal,” and if the student has previously been found responsible for any academic integrity violations. The executive director of the MEM Program in consultation with the associate dean for Student Conduct serves as a “clearinghouse” for Duke Community Standard violations, so that\n\n- there is consistency in defining what violations are “minimal”;\n- the consequences for various types of violations are consistent; and\n- repeated violations by the same student in different courses do not go unnoticed.\n\nWhen these conditions for a “one-time student-faculty resolution” are met, the instructor may impose consequences for the violation and inform the executive director of the MEM Program of the consequences. These could include receiving failing grades on the assignment or the course, repeating one or more assignments, and/or completing a separate assignment intended to inform the student about academic integrity (e.g., a paper analyzing the consequences of failure to cite sources properly).\n\nIf the instructor does not want to use this option, he/she may request an administrative hearing. If the student does not agree with the resolution proposed by the instructor, he/she may request an administrative hearing.\n\nAdministrative Hearing. If the suspected violation is not “minimal,” if there have been previous violations, if the instructor chooses not to resolve the case, or if the student disagrees with the instructor’s proposed resolution, the case goes to an administrative hearing. If the violation is severe enough to put the student at risk of suspension or dismissal, and if the accused student denies the accusation, he/she may ask to bypass the administrative hearing level and go directly to an ad hoc judicial panel, as explained below.\n\nIf the student admits violating the policy and accepts responsibility for his/her actions, the executive director of the MEM Program, in consultation with the associate dean for student conduct, will recommend the appropriate disciplinary action. Consequences may include probation, suspension, or expulsion, and/or assignments intended to educate the student about academic standards. Consequences may include recommendations to the course instructor involving grades for one or more assignments or for the whole course, but final authority for these rests with the instructor. If the student believes the administrative hearing failed to consider relevant information, violated fair procedures in some other way, or imposed consequences inappropriate to the offense, he/she may appeal the decision to an ad hoc student conduct panel."
            },
            {
                "tool_name": "keyword_retriever",
                "context": "url: https://ugstudies.dukekunshan.edu.cn/academic-policies-and-procedures/\n\nA single or more grade of F or NC (excluding PE courses) in a term\n2. A second or more grade of D (D, D-, D+) over the student’s tenure at DKU\n3. Failure to meet the term credit requirements (See section on Term Credit Requirements\n\nAll students issued an academic warning are required to meet with the Director for Academic Advising or designee to discuss their academic progress. Students should also consult with their academic advisor.\n\n \n\n \n\n##### Academic Probation\n\n \n\nFor a student enrolled in 16 or more credits, the following grades will result in academic probation for the succeeding spring or fall term: during the first term of the freshman year, grades including DD, DF, or FF; during any subsequent spring/fall term, grades including DDD, DF or FF (as long as the student has passed at least 12 credits); and during two consecutive spring/fall terms, grades including DDDD, DDDF, or DDFF. For a student enrolled in an authorized underload (i.e., fewer than 16 credits), the following academic performance will result in academic probation: during the first term of the freshman year, grades of DD or F; during any subsequent fall/spring term, grades including DDD or DF (as long as 12 credits have been passed in that term); and during two consecutive spring/fall terms, grades including DDDD, DDDF, or DDFF. In a case where probation may be in question because of an incomplete grade, the student will be notified by the Office of the Registrar of the need to have the incomplete replaced by a satisfactory grade in order to avoid academic probation. That is, the satisfactory final grade must be sufficient to avoid the combination of D and F grades that would result in academic probation, as described above.\n\n \n\nThe probation status will be reflected on those academic records used for internal purposes only. Students placed on academic probation must acknowledge their probationary status in writing to the Office of Undergraduate Studies in order to continue at the University. They are also required to meet with the Director for Academic Advising or designee and are expected to seek assistance from campus resources, have their course selection approved by their advisors and meet periodically with a designated academic coach. They may not study away during the probation period. Students are expected to clear their probationary status during the term of probation. In order to do so, they must enroll in 16 credits (plus up to one PE credit), of which no more than 4 credits may be taken on a Credit/No Credit basis. Grades of C, CR, or better must be earned in each course, or a C average must be achieved in that term.\n\n \n\nProbationary status cannot be cleared in a term in which students seek permission and are allowed to withdraw to an underload. In such cases, the probationary status continues through the next fall or spring term of enrollment. Students who clear their probationary status by earning a C average in the term but also earn grades that would result in academic probation as described above will continue their probationary status through the next term of enrollment. Students on probation, whether in a normal load or an underload, are required to earn grades of C, CR, or better in each course, or achieve a C average in that term. Students whose probationary status continues to a second term for reason of an underload must adhere to the conditions and standards previously outlined for clearing probation. Failure to do so will result in academic suspension.\n\n \n\n \n\n##### Academic Suspension\n\n  \n\nStudents on academic probation must clear their probationary status as described above (see section on Academic Probation) in order to continue at Duke Kunshan University. For the purposes of clearing academic probation, incomplete work in any course is considered a failure to achieve satisfactory performance in that course. Therefore, where term continuation is in question, incomplete work in any course must be completed with a satisfactory grade sufficient to clear the probationary status in time for final grades to be submitted to the Office of the University Registrar no later than the weekday preceding the first day of classes of the subsequent fall or spring term.\n\n \n\nStudents who fail to meet the minimum requirements to clear their probationary status are subject to academic suspension for a period of at least two terms (excluding summer term). Those desiring to return after the suspension period may apply for Return to the University. Such students are placed on academic probation if reinstated. Please contact the Office of Undergraduate Studies for more information. Deadlines for filing this application are 5:00 p.m.\n\nurl: https://ugstudies.dukekunshan.edu.cn/academic-policies-and-procedures/\n\nDeadlines for filing this application are 5:00 p.m. China time May 1 for return in the subsequent Fall Term and October 15 for return in the subsequent Spring Term. If after return the student fails again to meet the minimum academic requirements and is suspended a second time, the student will be ineligible to enroll again in the future.\n\n \n\nThough rarely granted, a student suspended for failure to clear their probationary status may appeal for immediate reinstatement. Students should contact the Director for Academic Advising or designee, and adhere to deadlines stated in their suspension letter.\n\n\n\n\nAcademic Warning, Probation, and Suspension for Students in the Class of 2025 and Beyond\n----------------------------------------------------------------------------------------\n\n\nA student whose academic performance record indicates marginal scholarship, as assessed by grades, as well as term and cumulative grade-point averages, will be subject either to academic warning or academic probation. Failure to clear probationary status in the term of probation will result in a student’s suspension for academic reasons.\n\n \n\nIn determining whether a student should be placed on academic warning, a grade of NC earned in a course, whether that course is offered only on the CR/NC basis or the student elects to take it on the CR/NC basis, is considered equivalent to a grade of F. (See also the section on CR/NC Grading system).\n\n \n\nFor purposes of determining academic standing, incomplete work in a course indicated by a grade of I is considered equivalent to a grade of F until the I is resolved. (See section on Incomplete Coursework.) Grades in PE courses are not considered in determining academic warning, probation, or suspension.\n\n \n\n \n\n##### Academic Warning\n\n  \n\nFailure to meet any of the following standards will result in academic warning by the Office of Undergraduate Studies:\n\n \n\n1. A single or more grade of F or NC (excluding PE courses) in a term\n2. A second or more grade of D (D, D-, D+) over the student’s tenure at DKU\n3. Failure to meet the term credit requirements (See section on Term Credit Requirements\n\n All students issued an academic warning are required to meet with the Director for Academic Advising or designee to discuss their academic progress. Students should also consult with their academic advisor.\n\n \n\n \n\n##### Academic Probation\n\n \n\nAt the end of each fall and spring term, a student must have both a term and a cumulative grade point average of at least 2.000. Failure to meet either of the two following standards will result in academic probation for the following fall or spring term:\n\n \n\n1. Term grade-point average below 2.000 for any fall or spring term\n2. Cumulative grade-point average falls below 2.000 at the end of any fall or spring term\n\n In a case where probation may be in question because of an incomplete grade, the student will be notified by the Office of the Registrar of the need to have the incomplete replaced by a satisfactory grade in order to avoid academic probation. That is, the satisfactory final grade must be sufficient to raise both the term and the cumulative grade-point averages to or above 2.000.\n\n \n\nThe probation status will be reflected on those academic records used for internal purposes only. Students placed on academic probation must acknowledge their probationary status in writing to the Office of Undergraduate Studies in order to continue at the University. They are also required to meet with the Director for Academic Advising or designee and are expected to seek assistance from campus resources, have their course selection approved by their advisors and meet periodically with a designated academic coach. They may not study away during the probation period. Students are expected to clear their probationary status during the term of probation. In order to do so, they must enroll in 16 credits (plus up to one PE credit), of which no more than 4 credits may be taken on a Credit/No Credit basis, and achieve term and cumulative grade-point averages of at least 2.000.\n\n \n\nProbationary status cannot be cleared in a term in which students seek permission and are allowed to withdraw to an underload. In such cases, the probationary status continues through the next fall or spring term of enrollment. Students on probation, whether in a normal load or an underload, are required to achieve the minimum term and cumulative grade-point averages of at least 2.000. Students whose probationary status continues to a second term for reason of an underload must adhere to the conditions and standards previously outlined for clearing probation.\n\nurl: no url\n\n# Academic Probation\n\nFor a student enrolled in an authorized underload (i.e., fewer than 16 credits), the following academic performance will result in academic probation: during the first term of the freshman year, grades of DD or F; during any subsequent fall/spring term, grades including DDD or DF (as long as 12 credits have been passed in that term); and during two consecutive spring/fall terms, grades including DDDD, DDDF, or DDFF. In a case where probation may be in question because of an incomplete grade, the student will be notified by the Office of the Registrar of the need to have the incomplete replaced by a satisfactory grade in order to avoid academic probation. That is, the satisfactory final grade must be sufficient to avoid the combination of D and F grades that would result in academic probation, as described above.\n\nThe probationary status will be reflected on those academic records used for internal purposes only. Students placed on academic probation must acknowledge their probationary status in writing to the Office of Undergraduate Advising in order to continue at the University. They are also required to meet with the Director of Academic Advising or designee and are expected to seek assistance from campus resources, have their course selection approved by their advisors and meet periodically with a designated academic coach. They may not study away during the probation period. Students are expected to clear their probationary status during the term of probation. In order to do so, they must enroll in 16 credits (plus up to one PE credit), of which no more than 4 credits may be taken on a Credit/No Credit basis. Grades of C, CR, or better must be earned in each course, or a C average must be achieved in that term.\n\nProbationary status cannot be cleared in a term in which students seek permission and are allowed to withdraw to an underload. In such cases, the probationary status continues through the next fall or spring term of enrollment. Students who clear their probationary status by earning a C average in the term but also earn grades that would result in academic probation as described above will continue their probationary status through the next term of enrollment. Students on probation, whether in a normal load or an underload, are required to earn grades of C, CR, or better in each course, or achieve a C average in that term. Students whose probationary status continues to a second term for reason of an underload must adhere to the conditions and standards previously outlined for clearing probation. Failure to do so will result in academic suspension.\n\n# Academic Suspension\n\nStudents on academic probation must clear their probationary status as described above (see section on Academic Probation) in order to continue at Duke Kunshan University. For the purposes of clearing academic probation, incomplete work in any course is considered a failure to achieve satisfactory performance in that course. Therefore, where academic suspension is in question, incomplete work in any course must be completed with a satisfactory grade sufficient to clear the probationary status in time for final grades to be submitted to the Office of the Registrar no later than the weekday preceding the first day of classes of the subsequent fall or spring term.\n\nStudents who fail to meet the minimum requirements to clear their probationary status are subject to academic suspension for a period of at least two terms (excluding summer term). Those desiring to return after the suspension period may apply for Return to the University. Such students are placed on academic probation if reinstated. Please contact the Office of Undergraduate Studies for\n\nurl: no url\n\n# Academic Policies\n\n# Signature Work Academic Warning\n\nAll students issued a signature work academic warning are required to meet with the Director of Academic Advising or designee and the Director of Signature Work or designee. The student’s signature work mentor and academic advisor will be notified and may also be present at the meeting. If the signature work mentor and/or academic advisor is not present at the meeting, the student should also consult with them.\n\n# Academic Probation\n\nAt the end of each fall and spring term, a student must have both a term and a cumulative grade point average of at least 2.000. Failure to meet either of the two following standards will result in academic probation for the following fall or spring term:\n\n1. Term grade-point average below 2.000 for any fall or spring term\n2. Cumulative grade-point average falls below 2.000 at the end of any fall or spring term.\n\nIn a case where probation may be in question because of an incomplete grade, the student will be notified by the Office of the Registrar of the need to have the incomplete replaced by a satisfactory grade in order to avoid academic probation. That is, the satisfactory final grade must be sufficient to raise both the term and the cumulative grade-point averages to or above 2.000.\n\nThe probationary status will be reflected on those academic records used for internal purposes only. Students placed on academic probation must acknowledge their probationary status in writing to the Office of Undergraduate Advising in order to continue at the University. They are also required to meet with the Director of Academic Advising or designee and are expected to seek assistance from campus resources, have their course selection approved by their advisors and meet periodically with a designated academic coach. They may not study away during the probation period. Students are expected to clear their probationary status during the term of probation. In order to do so, they must enroll in 16 credits (plus up to one PE credit), of which no more than 4 credits may be taken on a Credit/No Credit basis, and achieve term and cumulative grade-point averages of at least 2.000.\n\nProbationary status cannot be cleared in a term in which students seek permission and are allowed to withdraw to an underload. In such cases, the probationary status continues through the next fall or spring term of enrollment. Students on probation, whether in a normal load or an underload, are required to achieve the minimum term and cumulative grade-point averages of at least 2.000. Students whose probationary status continues to a second term for reason of an underload must adhere to the conditions and standards previously outlined for clearing probation. Failure to do so will result in academic suspension.\n\n# Academic Suspension\n\nStudents on academic probation must clear their probationary status as described above (see section on Academic Probation) in order to continue at Duke Kunshan University. For the purposes of clearing academic probation, incomplete work in any course is considered a failure to achieve satisfactory performance in that course. Therefore, where academic suspension is in question, incomplete work in any course must be completed with a passing grade in time for final grades to\n\nurl: no url\n\n# Academic Suspension\n\nStudents on academic probation must clear their probationary status as described above (see section on Academic Probation) in order to continue at Duke Kunshan University. For the purposes of clearing academic probation, incomplete work in any course is considered a failure to achieve satisfactory performance in that course. Therefore, where academic suspension is in question, incomplete work in any course must be completed with a satisfactory grade sufficient to clear the probationary status in time for final grades to be submitted to the Office of the Registrar no later than the weekday preceding the first day of classes of the subsequent fall or spring term.\n\nStudents who fail to meet the minimum requirements to clear their probationary status are subject to academic suspension for a period of at least two terms (excluding summer term). Those desiring to return after the suspension period may apply for Return to the University. Such students are placed on academic probation if reinstated. Please contact the Office of Undergraduate Studies for more information. Deadlines for filing this application are 5:00 p.m. China time May 1 for return in the subsequent Fall Term and October 15 for return in the subsequent Spring Term (see section on Return). If after return the student fails again to meet the minimum academic requirements and is suspended a second time, the student is eligible to apply for return no sooner than two years or four terms (excluding summer terms) after the term of the second withdrawal.\n\nThough rarely granted, a student suspended for failure to clear their probationary status may appeal for immediate reinstatement. Students should contact the Director of Academic Advising or designee and adhere to deadlines stated in their suspension letter.\n\n# Academic Warning, Probation, and Suspension for Students in the Class of 2025 and Beyond\n\nA student whose academic performance record indicates marginal scholarship, as assessed by grades, as well as term and cumulative grade-point averages, will be subject either to academic warning or academic probation. Failure to clear probationary status in the term of probation will result in a student’s suspension for academic reasons. Students who are not making satisfactory progress meeting Signature Work milestones will be issued an academic warning.\n\nIn determining whether a student should be placed on academic warning, a grade of NC earned in a course, whether that course is offered only on the CR/NC basis or the student elects to take it on the CR/NC basis, is considered equivalent to a grade of F (see also the section on CR/NC Grading system).\n\nFor purposes of determining academic standing, incomplete work in a course indicated by a grade of I is considered equivalent to a grade of F until the I is resolved (see section on Incomplete Coursework). Grades in PE courses are not considered in determining academic warning, probation, or suspension."
            }
        ],
        "generated_answer": "At Duke Kunshan University, a student is considered to be on academic probation if they have a term or cumulative grade-point average below 2.000 at the end of any fall or spring term. This can also happen if a student has a single or more grade of F or NC (excluding PE courses) in a term, a second or more grade of D (D, D-, D+) over their tenure at DKU, or failure to meet the term credit requirements.\n\nreference links:\n* [Duke Kunshan University's Academic Policies and Procedures](https://ugstudies.dukekunshan.edu.cn/academic-policies-and-procedures/)"
    }
]