[
    {
        "query": "Can I change my declared major?\",",
        "retrieved_contexts": [
            {
                "tool_name": "vector_retriever",
                "context": "url: no url\n\nDisciplinary Courses\n\nCourse Code Course Name Course Credit CULANTH 201/MEDIA 201 New Media and Society 4 MEDIART 211 Media, Arts, and Critical Theory 4 And choose two of the following courses CULANTH 202/MEDIA 202/GCULS 201 Culture and Industry 4 CULANTH 207/MEDIA 207 Cultures of New Media 4 GLHLTH 202 Media and Health Communication 4 LIT 204/MEDIA 204 Online Novels and the Chinese Public Sphere 4 INFOSCI 104/MEDIA 104 Digital Design 4 INFOSCI 201 Interaction and Physical Computing 4 MEDIA 203 [25] Global Media and Communication 4 MEDIART 208 [26] Chinese Mass Media 4 MEDIART 224 Animation: From Anima to Anime 4\n\nCreative Practice Elective Concentrations\n\nIn addition to serving as Creative Practice Concentrations, the courses listed in the tables below are recommended electives for the major. The course list reflects the most recent intellectual organization of major electives. Depending on the academic year in which you matriculated, some of the courses below may be requirements for your major. To verify required courses, always consult the requirements for the relevant class year in the bulletin of the year in which you matriculated unless you have been approved to complete the major requirements of a subsequent year. (See Ability to Meet Major Requirements Published in Years Subsequent to Year of Matriculation.)\n\nurl: no url\n\nStudents who choose an A+B option must complete consecutive courses. GCHINA 303 Translating and Using Chinese Non-fictional Sources For Academic Purposes 4 CHINESE 301 A + B Advanced Intermediate Chinese 1 2+2 CHINESE 302 A+B Advanced Intermediate Chinese 2 2+2 CHINESE 401A +B Advanced Chinese – Issues in Modern China 1 2+2 CHINESE 402A+B Advanced Chinese – Issues in Modern China 2 2+2 CHINESE 407 Readings in Classical Chinese 4 JAPANESE 101 Beginning Japanese 1 ( only fulfills requirement if student can display advanced working proficiency in Chinese) 4 And complete both of the following GCHINA 390 Junior Seminar: Advanced Topics 4 GCHINA 490 Senior Seminar: Advanced Topics 4\n\nDisciplinary Courses\n\nCourse Code Course Name Course Credit RELIG 101 Comparative Religious Studies 4 RELIG/CULMOV 205 Religion, Power, and Social Change 4 RELIG 302 [9] Religion and the Environment 4 Choose two of the following courses on different religious traditions RELIG 201 Confucianism, Daoism and Buddhism 4 RELIG 203 [10] History of God 4 RELIG 206 Animism, Shamanism, and Mediums 4 And choose one of the following courses RELIG 305 Modern Religion 4 HIST 201 History Methods and Research 4 CULANTH 101 Introduction to Cultural Anthropology 4 GCULS 105 Critical Comparative Studies 4\n\nElectives\n\nCourses listed in the table below are recommended electives for the major. The course list reflects the most recent intellectual organization of major electives. Depending on the academic year in which you matriculated, some of the courses below may be requirements for your major. To verify required courses, always consult the requirements for the relevant class year in the bulletin of the year in which you matriculated unless you have been approved to complete the major requirements of a subsequent year. (See Ability to Meet Major Requirements Published in Years Subsequent to Year of Matriculation.)\n\nNote: Students mainly interested in furthering their knowledge of Chinese religions can choose the Chinese religions track. Those interested in broader comparisons can choose Chinese religions compared. Those interested in non-Chinese religions can choose the non-Chinese religions track.\n\nurl: no url\n\nThe course list reflects the most recent intellectual organization of major electives. Depending on the academic year in which you matriculated, some of the courses below may be requirements for your major. To verify required courses, always consult the requirements for the relevant class year in the bulletin of the year in which you matriculated unless you have been approved to complete the major requirements of a subsequent year. (See Ability to Meet Major Requirements Published in Years Subsequent to Year of Matriculation.)\n\nNote: Students mainly interested in furthering their knowledge of Chinese religions can choose the Chinese religions thematic area. Those interested in broader comparisons can choose Chinese religions compared. Those interested in non-Chinese religions can choose the non-Chinese religions thematic area. Chinese Religions PHIL 102/HIST 101 Ancient Chinese History and Philosophy 4 HIST 102 Medieval Chinese History 4 HIST 103 Premodern Chinese History 4 RELIG 202 Modern Buddhism 4 CULANTH 107 [6] Food, Ethnicity, and Globalization 4 HIST 109 Everyday Maoism in Objects: Revolution, Culture, and Life 2 CULANTH 306 Borders, Boundaries and Ethnic Peoples in China 4 HIST 217/ARTS 217 [7] Arts of China 4 HIST 301 China in Global Perspective 1: China and the Silk Roads World: 500-1500 4 MEDIART 108 Love and Dreams on the Chinese Stage 2 Chinese Religions Compared PHIL 103 Chinese and Mediterranean Philosophy 4 RELIG 204 The Problem of Evil 4 RELIG 107 Readings in Religious Literature 2 CULMOV 202 Culture and Social Movements 4 CULANTH 405 Medical Anthropology 4 GCULS 301 Religion and Sexuality 4 GCULS 402 Digital Tribes 4 RELIG 303 The Human Condition 4 RELIG 304 Ethics in Religious Perspective 4 Non-Chinese Religions RELIG 103 Law and Revelation 4 RELIG 102 [8] The Historical Jesus 4 RELIG 104 Myth and Nation 4 RELIG 105 Gods and People 4 CULMOVE 206 Ethnic and Religious Diversity in the Middle East 4 POLSCI 312. Islamic Political Thought 4\n\nCultures and Movements / Sociology\n\nDivisional Foundation Courses\n\nCourse Code Course Name Course Credit SOSC 101 Foundational Questions in Social Science 4 SOSC 102 Introduction to Research Methods 4\n\nInterdisciplinary Courses\n\nCourse Code Course Name Course Credit CULMOVE 101 Cultures of Globalization 4 CULMOVE 201 Migration, Inequality and Culture 4 CULMOVE 203 Wealth, Inequality and Power 4 CULMOVE 302 [9] Culture and Social Movements 4 CULMOVE 390 Junior Seminar: Advanced Topics 4 CULMOVE 490 Senior Seminar: Advanced Topics 4\n\nDisciplinary Courses\n\nCourse Code Course Name Course Credit SOCIOL 101 [10] Introduction to Sociology 4 STATS 101 Introduction to Applied Statistical Methods 4 SOCIOL 305 Theory and Society 4 And choose two courses from the following six courses SOCIOL 202 Sociology of Culture 4 SOCIOL 204 Identity, Action, and Emotion 4 SOCIOL 211 Social Inequality 4 SOCIOL 212 [11] Contemporary Social Problems 4 SOCIOL 306 Contemporary Population Problems 4 SOCIOL 405 Sociology of Gender 4\n\nElectives\n\nCourses listed in the table below are recommended electives for the major. The course list reflects the most recent intellectual organization of major electives. Depending on the academic year in which you matriculated, some of the courses below may be requirements for your major. To verify required courses, always consult the requirements for the relevant class year in the bulletin of the year in which you matriculated unless you have been approved to complete the major requirements of a subsequent year. (See Ability to Meet Major Requirements Published in Years Subsequent to Year of Matriculation.)\n\nurl: no url\n\nMajor Requirements\n\n(Not every course listed is offered every term, and the course list will be updated periodically. Please refer to the online Course Catalog for Courses offered in 2023-2024.)\n\nArts and Media/Arts\n\nDivisional Foundation Courses\n\nCourse Code Course Name Course Credit ARHU 101 The Art of Interpretation: Written Texts 4 ARHU 102 The Art of Interpretation: Images and Sound 4\n\nInterdisciplinary Courses\n\nCourse Code Course Name Course Credit MEDIART 101 [2] Introduction to Arts and Media 4 MEDIART 209 Introduction to Visual Culture 4 MEDIART 210 [3] Arts and Media Practicum 4 MEDIART 490 Senior Seminar: Advanced Topics 4 Choose 4 Creative Practice Elective courses from within the same concentration, two at the 100-200 level and two at the 300-400 level.\n\nDisciplinary Courses\n\nCourse Code Course Name Course Credit HIST 207/ARTS 207 [4] History of Art and Science 4 HIST 210/ARTS 211 Global Art History 4 And choose two 4-credit courses from the list below ARTS 106/HIST 106 [5] European Art History 4 ARTS 201 [6] Introduction to Film Studies 4 ARTS 202 [7] Contemporary Documentary Film 4 GCHINA 203/ ARTS 203 Visual China 4 HIST 217/ ARTS 217 [8] Arts of China 4 HIST 218/ ARTS 218 [9] Women in East Asian Art 4 LIT 208/ARTS 208 From Cool Japan to the Korean Wave : Popular Culture from East Asia 4 MEDIART 211 Media, Arts, and Critical Theory 4 MEDIART 224 Animation: From Anima to Anime 4 PHYS 105 /ARTS 105 [10] The Science of Traditional Asian Music 4\n\nCreative Practice Elective Concentrations\n\nIn addition to serving as Creative Practice Concentrations, the courses listed in the tables below are recommended electives for the major. The course list reflects the most recent intellectual organization of major electives. Depending on the academic year in which you matriculated, some of the courses below may be requirements for your major. To verify required courses, always consult the requirements for the relevant class year in the bulletin of the year in which you matriculated unless you have been approved to complete the major requirements of a subsequent year. (See Ability to Meet Major Requirements Published in Years Subsequent to Year of Matriculation.)\n\nurl: no url\n\nStudents who choose an A+B option must complete consecutive courses. GCHINA 303 Translating and Using Chinese Non-fictional Sources For Academic Purposes 4 CHINESE 301 A+B Advanced Intermediate Chinese 1 2+2 CHINESE 302 A+B Advanced Intermediate Chinese 2 2+2 CHINESE 401 A +B Advanced Chinese – Issues in Modern China 1 2+2 CHINESE 402 A+B Advanced Chinese – Issues in Modern China 2 2+2 CHINESE 407 Readings in Classical Chinese 4 JAPANESE 101 Beginning Japanese 1 ( only fulfills requirement if student can display advanced working proficiency in Chinese) 4 And complete the following courses GCHINA 390 Junior Seminar: Advanced Topics 4 GCHINA 490 Senior Seminar: Advanced Topics 4\n\nDisciplinary Courses\n\nCourse Code Course Name Course Credit HIST 201 History Methods and Research 4 HIST 101 / PHIL 102 Ancient Chinese History and Philosophy 4 HIST 102 Medieval Chinese History 4 HIST 103 Premodern Chinese History 4 And one 4-credit Chinese History course (200-400 level) from among the electives recommended for this major 4 And one 4-credit non-Chinese History course (100-400 level) not listed among the electives recommended for this major 4\n\nElectives\n\nCourses listed in the table below are recommended electives for the major. The course list reflects the most recent intellectual organization of major electives. Depending on the academic year in which you matriculated, some of the courses below may be requirements for your major. To verify required courses, always consult the requirements for the relevant class year in the bulletin of the year in which you matriculated unless you have been approved to complete the major requirements of a subsequent year. (See Ability to Meet Major Requirements Published in Years Subsequent to Year of Matriculation.)"
            },
            {
                "tool_name": "keyword_retriever",
                "context": "url: no url\n\n# Table of Contents\n\n*****=need to be revised\n\nThis FAQ is meant to help students and their advisors understand academic policies in a clear and easily searchable manner. To search for answers either use the table of contents or use the search function (Ctrl+F or Command+F on most machines) to search for keywords such as “leave”, “incomplete”, “dean’s list”, etc. This page will not have every answer a student can come up with so for questions not answered here, or if there is a question you would like added to the list, please reach out to your advisor or to the Office of Undergraduate Advising at advising@dukekunshan.edu.cn.\n\n# General Advising:\n\n4\n\n# How should I prepare for my advising appointment?\n\n4\n\n# How can I find information about majors and academic policies?\n\n4\n\n# How often should I meet with my advisor?\n\n5\n\n# Can I change my academic advisor?\n\n5\n\n# Declare or Change a Major:\n\n5\n\n# When can I declare a major?\n\n5\n\n# What is the process for major declaration?\n\n5\n\n# Can I change my declared major?\n\n6\n\n# Is there a specific order of courses by semester I need to take in order to graduate?\n\n6\n\n# Curriculum:\n\n6\n\n# What are the core components of the DKU Curriculum?\n\n6\n\n# What are the Common Core courses?\n\n7\n\n# What are the Distribution Requirements?\n\n7\n\n# What is the Quantitative Reasoning Requirement?\n\n7\n\n# What are the required language courses?\n\n7\n\n# What’s Duke 34? How many credits must I earn from courses taught by Duke faculty and what are my options for doing so?\n\n8\n\n# What are the additional requirements for Mainland Chinese and HMT students?\n\n8\n\n# Can I take the Chinese Society and Culture courses as an international student?\n\n9\n\n# How many courses from foundations, interdisciplinary, and disciplinary studies should I have taken by the end of Year 2 to stay on track for completing a major?\n\n9\n\n# Course Registration:\n\n9\n\n# How to search for courses based on distribution requirements (attributes)?\n\n9\n\n# How do I find the courses taught by Duke Instructor (with DINS code)?\n\n9\n\n# Why do I have a ‘Hold’ in my account?\n\n10\n\n# Can I make changes to my course schedule after registration?\n\n10\n\n# Who should I consult if I have concerns related to my registration?\n\n10\n\n# Course Load:\n\n10\n\n# How many credits can I take in a semester?\n\n11\n\nurl: no url\n\nTo get a general sense of when courses are being offered, you can refer to the DKU Degree Course Planning Sheet, which can be found on the Office of Advising website at https://dukekunshan.edu.cn/en/academics/advising along with additional resources.\n\n# How often should I meet with my advisor?\n\nYou are required to meet with your advisor each semester before class registration and before you declare a major. Your advisor might arrange additional advising sessions throughout the semesters. You are also encouraged to be in touch with your advisor and reach out any time you have questions or concerns.\n\n# Can I change my academic advisor?\n\nIf you want a specific faculty to be your academic advisor, you should confirm it with both your current and potential advisor, reach an agreement, and then submit the request to the Office of Undergraduate Advising using the following link: https://dukekunshan.formstack.com/workflows/advisor_change_request_form\n\nAs part of the steps, you’ll be asked to complete a 4-year plan. This is for your new advisor to better understand your degree progress and for you two to discuss in your advising meetings.\n\nIt is not guaranteed that the switch can be made for a faculty advisor who is at their advisee limit, even if they agree. All requests are subject to review by the Director of Academic Advising or their designee.\n\n# Declare or Change a Major:\n\n# When can I declare a major?\n\nYou may declare a major in the Spring term of your sophomore year. All students must secure formal approval of their long-range plans and declare a major no later than the last teaching day of the first seven-week session in their fourth semester.\n\nUntil that time, students should be exploring different options of majors to ensure that they are making the best choice for themselves.\n\nStudents who do not declare their major may be prevented from registering for classes for their fifth undergraduate semester and from participating in a semester or study abroad program.\n\nInformation related to declaring your major will be provided in the 3rd 7-week session of the Sophomore year. Please refer to the Office of Undergraduate Advising if you have questions about the major declaration.\n\n# What is the process for major declaration?\n\nStep 1: Prepare to declare by identifying an intended major and planning a pathway to graduation\n\nStep 2: Advisor Meeting\n\nStep 3: Major Declaration Application Form\n\nurl: no url\n\n# Can I change my declared major?\n\n- Yes, but before you do so, please refer to the UG Bulletin and the DKU Degree Requirement Sheet about the new major requirements and work out a new 4-year graduation plan. This kind of planning is to make sure that you can graduate on time.\n- The next step is to consult your academic advisor about the new major and your plan.\n- After that, you can request to change your major by submitting a form to the Office of the University Registrar. Major Change Form may be found on the Registrar’s website under ‘Student Forms’ (https://www.dukekunshan.edu.cn/about/student-records-and-resources/).\n- No changes in majors can be made after the end of the Drop/Add period of the first session of the Fall term in the senior year.\n- Every change of major request is subject to review and is not guaranteed approval.\n\n# Is there a specific order of courses by semester I need to take in order to graduate?\n\n- No. Specific courses may not be offered in every session. Your exact pathway will depend on the courses offered in a particular semester, the pre-requisites you need to fulfill, your interests, and discussions with your advisor. Your goal should be to build your own pathway looking forward and make adjustments along the way with consideration to degree requirements. Counting as electives, courses outside major requirements can contribute to and enrich your college experience, learning, and understanding.\n\n# Curriculum:\n\n(For more information on curriculum, please refer to Part 3 of the UG Bulletin).\n\n# What are the core components of the DKU Curriculum?\n\n- General Education\n- 3 common core courses (12 credits)\n- 2-4 languages courses (8-16 credits)\n- 3 courses as distribution requirements (12 credits)\n- 1 quantitative reasoning course (4 credits)\n- Major\n- Divisional foundation courses\n- Interdisciplinary\n- Disciplinary\n- Signature work\n- Electives\n- Other requirements\n- 1 non-credit mini-term\n- 1 Signature work product\n\nurl: no url\n\nSkip to content\n\nFrequently Asked Questions about Academic Advising\n\nFull Advising FAQ list can be accessed here.\n\nTable of Contents\n\nFull Advising FAQ list can be accessed here.\n\nHow should I prepare for my advising appointment?\n\nPart of your experience at DKU is developing a high-quality advisor-student relationship. Prior to meeting with your academic advisor, reflect/revise your short-term and long-term goals, consider your strengths and areas of growth from previous session(s), take time to review courses/major(s) of interest, identify 5-6 courses you want to discuss with your advisor (be flexible). It’s always a good idea to write down all the topics you want to go over in order to ensure you do not miss anything.\n\nSchedule your appointment with your advisor at least a week in advance of registration and let them know if you already have specific questions you want to discuss. Finally, be open to having a constructive dialogue to set realistic expectations about your plan.\n\nYou might what to use the 4-year plan to map out what courses you have taken and what you have left to complete your major requirement.\n\nBack to top\n\nHow can I find information about majors and academic policies?\n\nYou may refer to the UG Bulletin, which can be found online at https://dukekunshan.edu.cn/en/registrar-office on the website of the Office of the Registrar. Be sure to keep using the Bulletin from the year you entered, newer versions may have requirements for new students that you will not be held to.\n\nTo get a general sense of when courses are being offered, you can refer to the DKU Degree Requirements Sheet, which can be found on the Office of Advising website at https://dukekunshan.edu.cn/en/academics/advising along with additional resources.\n\nBack to top\n\nHow often should I meet with my advisor?\n\nYou are required to meet with your advisor each semester before class registration and before you declare a major. Your advisor might arrange additional advising sessions throughout the semesters. You are also encouraged to be in touch with your advisor and reach out any time you have questions or concerns.\n\nBack to top\n\nCan I change my academic advisor?\n\nIf you want a specific faculty to be your academic advisor, you should confirm it with both your current and potential advisor, reach an agreement, and then submit the request to the Office of Undergraduate Advising using the following link: https://dukekunshan.formstack.com/workflows/advisor_change_request_form\n\nIt is not guaranteed that the switch can be made for a faculty advisor who is at their advisee limit, even if they agree. All requests are subject to review by the Director of Academic Advising or their designee.\n\nBack to top\n\nUniversity Home\n\nAbout\n\nAdmissions\n\nAcademics\n\nResearch\n\nCampus Life\n\nNews & Events\n\nUniversity Home\n\nAbout\n\nAdmissions\n\nAcademics\n\nResearch\n\nCampus Life\n\nNews & Events\n\nurl: https://globalhealth.dukekunshan.edu.cn/zh-hans/global-health-program/research-news/3/\n\nSkip to content\n\nFrequently Asked Questions about Academic Advising\n\nFull Advising FAQ list can be accessed here.\n\nTable of Contents\n\nFull Advising FAQ list can be accessed here.\n\nHow should I prepare for my advising appointment?\n\nPart of your experience at DKU is developing a high-quality advisor-student relationship. Prior to meeting with your academic advisor, reflect/revise your short-term and long-term goals, consider your strengths and areas of growth from previous session(s), take time to review courses/major(s) of interest, identify 5-6 courses you want to discuss with your advisor (be flexible). It’s always a good idea to write down all the topics you want to go over in order to ensure you do not miss anything.\n\nSchedule your appointment with your advisor at least a week in advance of registration and let them know if you already have specific questions you want to discuss. Finally, be open to having a constructive dialogue to set realistic expectations about your plan.\n\nYou might what to use the 4-year plan to map out what courses you have taken and what you have left to complete your major requirement.\n\nBack to top\n\nHow can I find information about majors and academic policies?\n\nYou may refer to the UG Bulletin, which can be found online at https://dukekunshan.edu.cn/en/registrar-office on the website of the Office of the Registrar. Be sure to keep using the Bulletin from the year you entered, newer versions may have requirements for new students that you will not be held to.\n\nTo get a general sense of when courses are being offered, you can refer to the DKU Degree Requirements Sheet, which can be found on the Office of Advising website at https://dukekunshan.edu.cn/en/academics/advising along with additional resources.\n\nBack to top\n\nHow often should I meet with my advisor?\n\nYou are required to meet with your advisor each semester before class registration and before you declare a major. Your advisor might arrange additional advising sessions throughout the semesters. You are also encouraged to be in touch with your advisor and reach out any time you have questions or concerns.\n\nBack to top\n\nCan I change my academic advisor?\n\nIf you want a specific faculty to be your academic advisor, you should confirm it with both your current and potential advisor, reach an agreement, and then submit the request to the Office of Undergraduate Advising using the following link: https://dukekunshan.formstack.com/workflows/advisor_change_request_form\n\nIt is not guaranteed that the switch can be made for a faculty advisor who is at their advisee limit, even if they agree. All requests are subject to review by the Director of Academic Advising or their designee.\n\nBack to top\n\nUniversity Home\n\nAbout\n\nAdmissions\n\nAcademics\n\nResearch\n\nCampus Life\n\nNews & Events\n\nUniversity Home\n\nAbout\n\nAdmissions\n\nAcademics\n\nResearch\n\nCampus Life\n\nNews & Events"
            }
        ],
        "generated_answer": "Yes, you can change your declared major. However, before doing so, please refer to the UG Bulletin and work out a new 4-year graduation plan with your academic advisor. This is to ensure that you can graduate on time. After that, you can request to change your major by submitting a form to the Office of the University Registrar. Major Change Form can be found on the Registrar's website under 'Student Forms' (https://www.dukekunshan.edu.cn/about/student-records-and-resources/). No changes in majors can be made after the end of the Drop/Add period of the first session of the Fall term in the senior year. Every change of major request is subject to review and is not guaranteed approval.\n\nreference links: \nFAQ page on declaring and changing majors at DKU\nMajor Change Form at DKU"
    }
]